{
  "$schema": "../fizzdragon-skill.schema.json",
  "schemaVersion": "fizzdragon.catalog-source/v1",
  "skillId": "10000000-0000-7000-8000-000000000017",
  "catalogOrder": 17,
  "displayDescription": "Build meaning through shot contrast, visual rhyme, tempo and precisely motivated cuts.",
  "translationKey": "rhythmicMontageEditor",
  "publisherName": "FizzDragon",
  "category": "production",
  "kind": "video",
  "visibility": "public",
  "status": "published",
  "preview": {
    "image": "rhythmic-montage-editor-v2.jpg",
    "video": null
  },
  "version": {
    "id": "20000000-0000-7000-8000-000000000017",
    "version": "1.0.0",
    "manifestSchemaVersion": "fizzdragon.skill/v1",
    "publishedAt": "2026-08-11T12:00:00.000Z",
    "capabilities": ["agent_prompt", "prompt_authoring", "video_generation"],
    "projectKinds": ["platform", "story"],
    "workbenchModes": [],
    "toolIds": [],
    "configSchema": {
      "type": "object",
      "additionalProperties": false,
      "properties": {}
    },
    "riskPolicy": {
      "allowsWrite": false,
      "allowsPaidGeneration": false
    },
    "evalSuite": "evals/project-skills/rhythmic-montage-editor/v1"
  }
}
