{
  "$schema": "../fizzdragon-skill.schema.json",
  "schemaVersion": "fizzdragon.catalog-source/v1",
  "skillId": "10000000-0000-7000-8000-000000000020",
  "catalogOrder": 20,
  "displayDescription": "Turn one recipe action into a tactile portrait-format cooking story with appetizing continuity and a clean payoff.",
  "translationKey": "portraitCookingShort",
  "publisherName": "FizzDragon",
  "category": "production",
  "kind": "video",
  "visibility": "public",
  "status": "published",
  "preview": {
    "image": "portrait-cooking-short.jpg",
    "video": "portrait-cooking-short.mp4"
  },
  "version": {
    "id": "20000000-0000-7000-8000-000000000020",
    "version": "1.0.0",
    "manifestSchemaVersion": "fizzdragon.skill/v1",
    "publishedAt": "2026-08-11T12:00:00.000Z",
    "capabilities": ["agent_prompt", "prompt_authoring", "video_generation"],
    "projectKinds": ["platform", "story"],
    "workbenchModes": [],
    "toolIds": [],
    "configSchema": {
      "type": "object",
      "additionalProperties": false,
      "properties": {}
    },
    "riskPolicy": {
      "allowsWrite": false,
      "allowsPaidGeneration": false
    },
    "evalSuite": "evals/project-skills/portrait-cooking-short/v1"
  }
}
