{
  "$schema": "../fizzdragon-skill.schema.json",
  "schemaVersion": "fizzdragon.catalog-source/v1",
  "skillId": "10000000-0000-7000-8000-000000000026",
  "catalogOrder": 26,
  "displayDescription": "Previsualize action with simple figures, legible staging, collision-safe geography and editable beat progression.",
  "translationKey": "actionStoryboardPrevisualizer",
  "publisherName": "FizzDragon",
  "category": "production",
  "kind": "general",
  "visibility": "public",
  "status": "published",
  "preview": {
    "image": "action-storyboard-previsualizer.jpg",
    "video": "action-storyboard-previsualizer.mp4"
  },
  "version": {
    "id": "20000000-0000-7000-8000-000000000026",
    "version": "1.0.0",
    "manifestSchemaVersion": "fizzdragon.skill/v1",
    "publishedAt": "2026-08-11T12:00:00.000Z",
    "capabilities": ["agent_prompt", "prompt_authoring", "image_generation", "video_generation"],
    "projectKinds": ["platform", "story"],
    "workbenchModes": [],
    "toolIds": [],
    "configSchema": {
      "type": "object",
      "additionalProperties": false,
      "properties": {}
    },
    "riskPolicy": {
      "allowsWrite": false,
      "allowsPaidGeneration": false
    },
    "evalSuite": "evals/project-skills/action-storyboard-previsualizer/v1"
  }
}
