{
  "$schema": "../fizzdragon-skill.schema.json",
  "schemaVersion": "fizzdragon.catalog-source/v1",
  "skillId": "10000000-0000-7000-8000-000000000023",
  "catalogOrder": 23,
  "displayDescription": "Direct restrained facial acting through readable eye, breath and muscle changes instead of exaggerated emotion.",
  "translationKey": "microExpressionPerformance",
  "publisherName": "FizzDragon",
  "category": "production",
  "kind": "video",
  "visibility": "public",
  "status": "published",
  "preview": {
    "image": "micro-expression-performance.jpg",
    "video": "micro-expression-performance.mp4"
  },
  "version": {
    "id": "20000000-0000-7000-8000-000000000023",
    "version": "1.0.0",
    "manifestSchemaVersion": "fizzdragon.skill/v1",
    "publishedAt": "2026-08-11T12:00:00.000Z",
    "capabilities": ["agent_prompt", "prompt_authoring", "video_generation"],
    "projectKinds": ["platform", "story"],
    "workbenchModes": [],
    "toolIds": [],
    "configSchema": {
      "type": "object",
      "additionalProperties": false,
      "properties": {}
    },
    "riskPolicy": {
      "allowsWrite": false,
      "allowsPaidGeneration": false
    },
    "evalSuite": "evals/project-skills/micro-expression-performance/v1"
  }
}
