{
  "$schema": "../fizzdragon-skill.schema.json",
  "schemaVersion": "fizzdragon.catalog-source/v1",
  "skillId": "10000000-0000-7000-8000-000000000011",
  "catalogOrder": 11,
  "displayDescription": "Readable product hierarchy, controlled materials, lighting and campaign-ready compositions.",
  "translationKey": "productEditorialPhotography",
  "publisherName": "FizzDragon",
  "category": "commercial",
  "kind": "image",
  "visibility": "public",
  "status": "published",
  "preview": {
    "image": "product-editorial-photography.jpg",
    "video": null
  },
  "version": {
    "id": "20000000-0000-7000-8000-000000000011",
    "version": "1.0.0",
    "manifestSchemaVersion": "fizzdragon.skill/v1",
    "publishedAt": "2026-08-11T12:00:00.000Z",
    "capabilities": ["prompt_authoring", "image_generation"],
    "projectKinds": ["platform", "story"],
    "workbenchModes": [],
    "toolIds": [],
    "configSchema": {
      "type": "object",
      "additionalProperties": false,
      "properties": {}
    },
    "riskPolicy": {
      "allowsWrite": false,
      "allowsPaidGeneration": false
    },
    "evalSuite": "evals/project-skills/product-editorial-photography/v1"
  }
}
