{
  "$schema": "../fizzdragon-skill.schema.json",
  "schemaVersion": "fizzdragon.catalog-source/v1",
  "skillId": "10000000-0000-7000-8000-000000000009",
  "catalogOrder": 9,
  "displayDescription": "Painted cel backgrounds, crisp character silhouettes and dramatic analog-era color design.",
  "translationKey": "retroAnimeKeyVisual",
  "publisherName": "FizzDragon",
  "category": "style",
  "kind": "general",
  "visibility": "public",
  "status": "published",
  "preview": {
    "image": "retro-anime-key-visual-v2.jpg",
    "video": null
  },
  "version": {
    "id": "20000000-0000-7000-8000-000000000009",
    "version": "1.0.0",
    "manifestSchemaVersion": "fizzdragon.skill/v1",
    "publishedAt": "2026-08-11T12:00:00.000Z",
    "capabilities": ["agent_prompt", "prompt_authoring", "image_generation", "video_generation"],
    "projectKinds": ["platform", "story"],
    "workbenchModes": [],
    "toolIds": [],
    "configSchema": {
      "type": "object",
      "additionalProperties": false,
      "properties": {}
    },
    "riskPolicy": {
      "allowsWrite": false,
      "allowsPaidGeneration": false
    },
    "evalSuite": "evals/project-skills/retro-anime-key-visual/v1"
  }
}
